click_number,reply_number,title,author,publish_time
432,48,满仓抄底被埋,梦里在京都,02月28日 
215,16,我吃过的盐比你们吃过的饺子还多,荣华盛泊里烧肉辛,今天08:35
607,46,猪肉荣已经完美的完成了掩护主力出货的历史,眨星星的眼睛,02月28日 
210,44,不管道指还是沪指,李久芹,今天09:00
69,0,明天下周又是喋喋不休啊,用户7285227042,今天16:34
57,1,世界形式不太乐观！,用户7371614573,今天15:52
71,0,留点弹药是必须的,用户7371614573,今天16:16
149,23,致市场的交易 在交易中所有的判断都是自己,YD888529以道,今天10:22
44,0,新证券法实施，大多人喊利空,乐洁家生活服务,今天13:46
117,0,谁都不要信，就信自己,用户7033326218,今天12:54
45,0,国内治愈数已超过确诊数一半,陈翰文1987,今天13:09
117,14,2020.3.2号周一，继续看涨,荣华盛泊里烧肉辛,今天05:39
99,0,06年大盘5000点19年3000点，行情是脱离实体经济的,qzuser33068一直,今天11:14
146,0,品种涨跌多少与主力持仓有紧密关系,用户7400914118,今天09:27
133,0,还是跟跌不跟涨的破烂货！,用户6902529274,今天08:56
109,0,共振引起的共涨,荣华盛泊里烧肉辛,今天07:15
113,0,2020.3.2～3.6全部上涨,荣华盛泊里烧肉辛,今天05:37
67,0,2020.3.2号周一，继续看涨,荣华盛泊里烧肉辛,今天05:28
129,0,就看下周一会不会跌破支撑了,尘起风扬的家6120,02月29日 
393,49,能夠預測股市的不是神仙就是騙子！,觀雨865,02月29日 
390,25,本次欧美股市大跌,东方老山羊,02月29日 
242,0,下周还不知道怎么跌,用户7285227042,02月29日 
220,0,跌跌跌,用户7285227042,02月29日 
363,4,為什麼我的帖子一直被刪,觀雨865,02月29日 
316,2,周一低开吗,用户7350277268,02月29日 
441,18,星期一能不跌就好了,用户7385563416,02月28日 
185,38,股市跌油市跌,吉林市孤烟纸业有,02月28日 
308,0,嗷嗷嗷～～～～,用户7033326218,02月29日 
309,0,全球都在抗疫情,用户7317314872,02月29日 
318,1,国家统计局网站公布的2月制造业PMI为3,眨星星的眼睛,02月29日 
